{
  "schema_version": 1,
  "task_id": "full-blueprint",
  "goal": "Implement previously deferred local orchestration capabilities and prepare bounded external integrations",
  "owner": "codex",
  "workspace": {
    "branch": "main",
    "worktree": ".",
    "claimed_files": [
      ".agent",
      ".codex",
      ".claude",
      ".githooks",
      ".github",
      "package.json",
      "tests",
      "docs/operations/agent-workflow.md"
    ]
  },
  "status": "complete",
  "base_commit": "41a238573b38d1aba26aaafbaaf4076237af45c9",
  "baseline_changes": [
    "M AGENTS.md",
    " M README.md",
    " D docs/COST_AND_CAPACITY.md",
    " D docs/JEV_APPLICATION_TRACKER_INTEGRATION_CONTEXT.md",
    " D docs/SECURITY_AUDIT.md",
    " D docs/architecture.md",
    " D docs/jev/README.md",
    " D docs/jev/adr-001-jev-only-decision-layer.md",
    " D docs/jev/architecture.md",
    " D docs/jev/data-model.md",
    " D docs/jev/decision-contract.md",
    " D docs/jev/development-plan.md",
    " D docs/jev/evaluation-and-rollout.md",
    " D docs/jev/stage-0-1-status.md",
    " D docs/jev/stage-2-3-status.md",
    " D docs/jev/stages-4-6-implementation.md",
    " D docs/operations.md",
    " D docs/sources.md",
    " M eslint.config.mjs",
    " M package.json",
    " M scripts/rematch-deterministic.ts",
    " M src/app/api/actions/route.ts",
    " M src/app/api/intelligence/route.ts",
    " M src/app/api/onboarding/route.ts",
    " M src/components/dashboard.tsx",
    " M src/components/workspace-page.tsx",
    " M src/lib/intelligence/worker.ts",
    " M src/lib/sync.ts",
    " M tests/database.test.ts",
    " M tsconfig.json",
    "?? .agent/",
    "?? .agents/",
    "?? .claude/",
    "?? .codex/",
    "?? docs/api/",
    "?? docs/architecture/",
    "?? docs/database/",
    "?? docs/operations/",
    "?? docs/security/",
    "?? src/components/dashboard/",
    "?? src/lib/actions/",
    "?? src/lib/matching-repository.ts",
    "?? tests/actions.test.ts",
    "?? tests/agent-index.test.ts",
    "?? tests/agent-workflow.test.ts",
    "?? tests/architecture.test.ts",
    "?? tests/dashboard-views.test.ts",
    "?? tests/matching-repository.test.ts"
  ],
  "intended_files": [
    ".agent",
    ".codex",
    ".claude",
    ".githooks",
    ".github",
    "package.json",
    "tests",
    "docs/operations/agent-workflow.md"
  ],
  "completed": [
    "Rechecked Git after externally renamed master to main; HEAD unchanged, existing work preserved.",
    "Added deterministic router, SQLite FTS documentation search, TypeScript symbol lookup, metrics and routing evaluations.",
    "Added role-scoped read-only capabilities, stdio MCP server, Claude and Git lifecycle hooks, shared worktree claims and portable search plugin.",
    "Added Codex and Claude client configuration plus GitHub Actions application verification.",
    "Updated workflow documentation and preserved the supplied blueprint byte-for-byte."
  ],
  "remaining": [],
  "verification": [
    "PASS: npm run agent:verify -- --application; context, formatting, architecture, routing evaluation, ESLint, TypeScript, 22 Vitest files/152 tests and Next production build.",
    "PASS: plugin manifest validation, capability denial tests, MCP protocol tests, lifecycle authorization tests and cross-worktree claim tests.",
    "LIMITATION: hosted CI and native Claude callbacks were configured but not remotely executed; no model behavior was claimed from deterministic routing tests."
  ]
}
