{
  "schema_version": 1,
  "task_id": "workspace-coordination",
  "goal": "Adapt worktree ownership, verification events, action classes and skill evaluation guidance",
  "owner": "codex",
  "workspace": {
    "branch": "master",
    "worktree": ".",
    "claimed_files": [
      ".agent/scripts/context-check.mjs",
      ".agent/scripts/contracts.mjs",
      ".agent/scripts/verify.mjs",
      ".agent/schemas/task-state.schema.json",
      "tests/agent-workflow.test.ts",
      "docs/operations/agent-workflow.md",
      "AGENTS.md"
    ]
  },
  "status": "complete",
  "base_commit": "41a238573b38d1aba26aaafbaaf4076237af45c9",
  "baseline_changes": [
    "M AGENTS.md",
    " M README.md",
    " D docs/COST_AND_CAPACITY.md",
    " D docs/JEV_APPLICATION_TRACKER_INTEGRATION_CONTEXT.md",
    " D docs/SECURITY_AUDIT.md",
    " D docs/architecture.md",
    " D docs/jev/README.md",
    " D docs/jev/adr-001-jev-only-decision-layer.md",
    " D docs/jev/architecture.md",
    " D docs/jev/data-model.md",
    " D docs/jev/decision-contract.md",
    " D docs/jev/development-plan.md",
    " D docs/jev/evaluation-and-rollout.md",
    " D docs/jev/stage-0-1-status.md",
    " D docs/jev/stage-2-3-status.md",
    " D docs/jev/stages-4-6-implementation.md",
    " D docs/operations.md",
    " D docs/sources.md",
    " M eslint.config.mjs",
    " M package.json",
    " M scripts/rematch-deterministic.ts",
    " M src/app/api/actions/route.ts",
    " M src/app/api/intelligence/route.ts",
    " M src/app/api/onboarding/route.ts",
    " M src/components/dashboard.tsx",
    " M src/components/workspace-page.tsx",
    " M src/lib/intelligence/worker.ts",
    " M src/lib/sync.ts",
    " M tests/database.test.ts",
    " M tsconfig.json",
    "?? .agent/",
    "?? .agents/",
    "?? .claude/",
    "?? .codex/",
    "?? docs/api/",
    "?? docs/architecture/",
    "?? docs/database/",
    "?? docs/operations/",
    "?? docs/security/",
    "?? src/components/dashboard/",
    "?? src/lib/actions/",
    "?? src/lib/matching-repository.ts",
    "?? tests/actions.test.ts",
    "?? tests/agent-index.test.ts",
    "?? tests/agent-workflow.test.ts",
    "?? tests/architecture.test.ts",
    "?? tests/dashboard-views.test.ts",
    "?? tests/matching-repository.test.ts"
  ],
  "intended_files": [
    ".agent",
    "tests/agent-workflow.test.ts",
    "docs/operations/agent-workflow.md",
    "AGENTS.md"
  ],
  "completed": [
    "Optional backward-compatible workspace and file-claim records",
    "Context checks for overlapping file/directory claims and shared checkouts",
    "Minimal verification event stream excludes raw output",
    "Action classes, secrets, hooks and skill evaluation matrix documented in existing guide",
    "Full verification passed; task claims released by completion"
  ],
  "remaining": [],
  "verification": [
    "npm run agent:verify: exit 0; context/format/architecture/lint/types/141 tests passed",
    "Actual Git worktree inventory inspected; no new worktrees created",
    "Build/browser skipped: developer tooling only",
    "Skill evaluation scenarios defined; model-based behavioral evaluations not run"
  ]
}
