{
  "schema_version": 1,
  "task_id": "impact-upgrade",
  "goal": "Subsystem map, conservative impact reporting and enforced existing boundaries",
  "owner": "codex",
  "status": "complete",
  "base_commit": "41a238573b38d1aba26aaafbaaf4076237af45c9",
  "baseline_changes": [
    "M AGENTS.md",
    " M docs/architecture.md",
    " M docs/operations.md",
    " M eslint.config.mjs",
    " M package.json",
    " M scripts/rematch-deterministic.ts",
    " M src/app/api/actions/route.ts",
    " M src/app/api/intelligence/route.ts",
    " M src/app/api/onboarding/route.ts",
    " M src/components/dashboard.tsx",
    " M src/components/workspace-page.tsx",
    " M src/lib/intelligence/worker.ts",
    " M src/lib/sync.ts",
    " M tests/database.test.ts",
    " M tsconfig.json",
    "?? .agent/",
    "?? .agents/",
    "?? .claude/",
    "?? .codex/",
    "?? docs/agent-workflow.md",
    "?? docs/codex_claude_unified_orchestration_blueprint.md",
    "?? src/components/dashboard/",
    "?? src/lib/actions/",
    "?? src/lib/matching-repository.ts",
    "?? tests/actions.test.ts",
    "?? tests/agent-index.test.ts",
    "?? tests/agent-workflow.test.ts",
    "?? tests/architecture.test.ts",
    "?? tests/dashboard-views.test.ts",
    "?? tests/matching-repository.test.ts"
  ],
  "intended_files": [
    ".agent",
    "tests/agent-index.test.ts",
    "tests/architecture.test.ts",
    "docs/agent-workflow.md",
    "package.json"
  ],
  "completed": [
    "Single-package subsystem map with validated paths and dependency references",
    "Current-source impact analysis with conservative historical and conceptual dependencies",
    "Task-associated Git observations without authorship claims",
    "Resolved matching/action import enforcement integrated into verification",
    "Capability selection and least-privilege documentation",
    "Full verification passed"
  ],
  "remaining": [],
  "verification": [
    "npm run agent:verify: exit 0; context, format, architecture, lint, types and 138 tests passed",
    "Matching impact and task-associated change commands: exit 0",
    "Build skipped: development tooling only"
  ]
}
