{
  "schema_version": 1,
  "task_id": "platform-architecture",
  "goal": "Document the core platform, optional JEV boundary and shared lifecycle",
  "owner": "codex",
  "status": "complete",
  "base_commit": "41a238573b38d1aba26aaafbaaf4076237af45c9",
  "baseline_changes": [
    " M AGENTS.md",
    " M README.md",
    " D docs/COST_AND_CAPACITY.md",
    " D docs/JEV_APPLICATION_TRACKER_INTEGRATION_CONTEXT.md",
    " D docs/SECURITY_AUDIT.md",
    " D docs/architecture.md",
    " D docs/jev/README.md",
    " D docs/jev/adr-001-jev-only-decision-layer.md",
    " D docs/jev/architecture.md",
    " D docs/jev/data-model.md",
    " D docs/jev/decision-contract.md",
    " D docs/jev/development-plan.md",
    " D docs/jev/evaluation-and-rollout.md",
    " D docs/jev/stage-0-1-status.md",
    " D docs/jev/stage-2-3-status.md",
    " D docs/jev/stages-4-6-implementation.md",
    " D docs/operations.md",
    " D docs/sources.md",
    " M eslint.config.mjs",
    " M package.json",
    " M scripts/rematch-deterministic.ts",
    " M src/app/api/actions/route.ts",
    " M src/app/api/intelligence/route.ts",
    " M src/app/api/onboarding/route.ts",
    " M src/components/dashboard.tsx",
    " M src/components/workspace-page.tsx",
    " M src/lib/intelligence/worker.ts",
    " M src/lib/sync.ts",
    " M tests/database.test.ts",
    " M tsconfig.json",
    "?? .agent/",
    "?? .agents/",
    "?? .claude/",
    "?? .codex/",
    "?? docs/api/",
    "?? docs/architecture/",
    "?? docs/database/",
    "?? docs/operations/",
    "?? docs/security/",
    "?? src/components/dashboard/",
    "?? src/lib/actions/",
    "?? src/lib/matching-repository.ts",
    "?? tests/actions.test.ts",
    "?? tests/agent-index.test.ts",
    "?? tests/agent-workflow.test.ts",
    "?? tests/architecture.test.ts",
    "?? tests/dashboard-views.test.ts",
    "?? tests/matching-repository.test.ts"
  ],
  "intended_files": ["docs", "README.md", ".agent/context", ".agent/index"],
  "completed": [
    "Expanded whole-platform context, actors, processes, components, flows and deployment boundaries",
    "Expanded existing API and database guides with the core platform before JEV",
    "Documented optional JEV modes without claiming an exact historical checkout",
    "Adapted ownership, adaptive lifecycle, compact handoff and evidence invalidation guidance",
    "Updated README, project context, navigation and generated indices",
    "Documentation verification passed"
  ],
  "remaining": [],
  "verification": [
    "npm run agent:verify -- --docs: exit 0; context, link, index, skill-drift and formatting checks passed",
    "Source inspection: auth, workspace, focused reads, actions, matching, SQL migrations and deployment manifests",
    "Runtime tests/build/browser skipped: documentation-only scope"
  ]
}
