{
  "schema_version": 1,
  "task_id": "recovery-guidance",
  "goal": "Adapt restartability, conflict checks, dependency selection and context navigation",
  "owner": "codex",
  "workspace": {
    "branch": "master",
    "worktree": ".",
    "claimed_files": [
      ".agent/scripts/changed-files.mjs",
      "tests/agent-index.test.ts",
      ".agent/context/navigation.md",
      ".agent/context/dependencies.md",
      "docs/operations/agent-workflow.md"
    ]
  },
  "status": "complete",
  "base_commit": "41a238573b38d1aba26aaafbaaf4076237af45c9",
  "baseline_changes": [
    "M AGENTS.md",
    " M README.md",
    " D docs/COST_AND_CAPACITY.md",
    " D docs/JEV_APPLICATION_TRACKER_INTEGRATION_CONTEXT.md",
    " D docs/SECURITY_AUDIT.md",
    " D docs/architecture.md",
    " D docs/jev/README.md",
    " D docs/jev/adr-001-jev-only-decision-layer.md",
    " D docs/jev/architecture.md",
    " D docs/jev/data-model.md",
    " D docs/jev/decision-contract.md",
    " D docs/jev/development-plan.md",
    " D docs/jev/evaluation-and-rollout.md",
    " D docs/jev/stage-0-1-status.md",
    " D docs/jev/stage-2-3-status.md",
    " D docs/jev/stages-4-6-implementation.md",
    " D docs/operations.md",
    " D docs/sources.md",
    " M eslint.config.mjs",
    " M package.json",
    " M scripts/rematch-deterministic.ts",
    " M src/app/api/actions/route.ts",
    " M src/app/api/intelligence/route.ts",
    " M src/app/api/onboarding/route.ts",
    " M src/components/dashboard.tsx",
    " M src/components/workspace-page.tsx",
    " M src/lib/intelligence/worker.ts",
    " M src/lib/sync.ts",
    " M tests/database.test.ts",
    " M tsconfig.json",
    "?? .agent/",
    "?? .agents/",
    "?? .claude/",
    "?? .codex/",
    "?? docs/api/",
    "?? docs/architecture/",
    "?? docs/database/",
    "?? docs/operations/",
    "?? docs/security/",
    "?? src/components/dashboard/",
    "?? src/lib/actions/",
    "?? src/lib/matching-repository.ts",
    "?? tests/actions.test.ts",
    "?? tests/agent-index.test.ts",
    "?? tests/agent-workflow.test.ts",
    "?? tests/architecture.test.ts",
    "?? tests/dashboard-views.test.ts",
    "?? tests/matching-repository.test.ts"
  ],
  "intended_files": [
    ".agent",
    "tests/agent-index.test.ts",
    "docs/operations/agent-workflow.md"
  ],
  "completed": [
    "Read-only resume diagnostics compare task baseline, current HEAD, branch/worktree and context",
    "Navigation maps task areas to real skills and existing decisions",
    "Dependency and external evidence selection guidance updated",
    "Examples adapted to opaque sessions, existing verification and production authorization boundaries",
    "Full verification and recovery success/warning paths passed"
  ],
  "remaining": [],
  "verification": [
    "npm run agent:verify: exit 0; context, formatting, architecture, lint, types and 142 tests passed",
    "Resume current task: exit 0; legacy task without workspace: expected exit 1; both verified false",
    "Build/browser skipped: tooling and documentation only"
  ]
}
